<?xml version="1.0" encoding="utf-8"?>
<!DOCTYPE configurationRegisters SYSTEM "../configurationRegisters.dtd">
<configurationRegisters>

  <specialFunctionRegisters>

    <CPUCore>
      <sfr key="WREG" addr="0x0FFF" por="xxxxxxxxxxxxxxxx" mclr="uuuuuuuuuuuuuuuu"></sfr>
    </CPUCore>

    <InterruptControl>
      <sfr key="INTCON" addr="0xFF2" por="0000000000000000" mclr="0000000000000000">
        <field key="GIE" instance="1" mask="0x0080" desc=""></field>
        <field key="PEIE" instance="1" mask="0x0040" desc=""></field>
        <field key="TMR0IE" instance="1" mask="0x0020" desc=""></field>
        <field key="T0IE" instance="1" mask="0x0020" desc=""></field>
        <field key="INT0IE" instance="1" mask="0x0010" desc=""></field>
        <field key="RBIE" instance="1" mask="0x0008" desc=""></field>
        <field key="TMR0IF" instance="1" mask="0x0004" desc=""></field>
        <field key="T0IF" instance="1" mask="0x0004" desc=""></field>
        <field key="INT0IF" instance="1" mask="0x0002" desc=""></field>
        <field key="RBIF" instance="1" mask="0x0001" desc=""></field>
      </sfr>
      <sfr key="INTCON2" addr="0xFF1" por="1111111111111111" mclr="0000000000000000">
        <field key="RBPU" instance="1" mask="0x0080" desc=""></field>
        <field key="INTEDG0" instance="1" mask="0x0040" desc=""></field>
        <field key="INTEDG1" instance="1" mask="0x0020" desc=""></field>
        <field key="INTEDG2" instance="1" mask="0x0010" desc=""></field>
        <field key="INTEDG3" instance="1" mask="0x0008" desc=""></field>
        <field key="TMR0IP" instance="1" mask="0x0004" desc=""></field>
        <field key="T0IP" instance="1" mask="0x0004" desc=""></field>
        <field key="INT3IP" instance="1" mask="0x0002" desc=""></field>
        <field key="RBIP" instance="1" mask="0x0001" desc=""></field>
      </sfr>
      <sfr key="INTCON3" addr="0xFF0" por="0000000011000000" mclr="0000000000000000">
        <field key="INT2IP" instance="1" mask="0x0080" desc=""></field>
        <field key="INT1IP" instance="1" mask="0x0040" desc=""></field>
        <field key="INT3IE" instance="1" mask="0x0020" desc=""></field>
        <field key="INT2IE" instance="1" mask="0x0010" desc=""></field>
        <field key="INT1IE" instance="1" mask="0x0008" desc=""></field>
        <field key="INT3IF" instance="1" mask="0x0004" desc=""></field>
        <field key="INT2IF" instance="1" mask="0x0002" desc=""></field>
        <field key="INT1IF" instance="1" mask="0x0001" desc=""></field>
      </sfr>
      <sfr key="IPR3" addr="0xFA5" por="1111111111111111" mclr="0000000000000000">
        <field key="SSP2IP" instance="1" mask="0x0080" desc=""></field>
        <field key="BCL2IP" instance="1" mask="0x0040" desc=""></field>
        <field key="RC2IP" instance="1" mask="0x0020" desc=""></field>
        <field key="TX2IP" instance="1" mask="0x0010" desc=""></field>
        <field key="U2TXIP" instance="1" mask="0x0010" desc=""></field>
        <field key="TMR4IP" instance="1" mask="0x0008" desc=""></field>
        <field key="T4IP" instance="1" mask="0x0008" desc=""></field>
        <field key="CCP5IP" instance="1" mask="0x0004" desc=""></field>
        <field key="CCP4IP" instance="1" mask="0x0002" desc=""></field>
        <field key="CCP3IP" instance="1" mask="0x0001" desc=""></field>
      </sfr>
      <sfr key="PIR3" addr="0xFA4" por="0000000000000000" mclr="0000000000000000">
        <field key="SSP2IF" instance="1" mask="0x0080" desc=""></field>
        <field key="BCL2IF" instance="1" mask="0x0040" desc=""></field>
        <field key="RC2IF" instance="1" mask="0x0020" desc=""></field>
        <field key="U2RXIP" instance="1" mask="0x0020" desc=""></field>
        <field key="TX2IF" instance="1" mask="0x0010" desc=""></field>
        <field key="U2TXIF" instance="1" mask="0x0010" desc=""></field>
        <field key="TMR4IF" instance="1" mask="0x0008" desc=""></field>
        <field key="T4IF" instance="1" mask="0x0008" desc=""></field>
        <field key="CCP5IF" instance="1" mask="0x0004" desc=""></field>
        <field key="CCP4IF" instance="1" mask="0x0002" desc=""></field>
        <field key="CCP3IF" instance="1" mask="0x0001" desc=""></field>
      </sfr>
      <sfr key="PIE3" addr="0xFA3" por="0000000000000000" mclr="0000000000000000">
        <field key="SSP2IE" instance="1" mask="0x0080" desc=""></field>
        <field key="BCL2IE" instance="1" mask="0x0040" desc=""></field>
        <field key="RC2IE" instance="1" mask="0x0020" desc=""></field>
        <field key="U2RXIE" instance="1" mask="0x0020" desc=""></field>
        <field key="TX2IE" instance="1" mask="0x0010" desc=""></field>
        <field key="U2TXIE" instance="1" mask="0x0010" desc=""></field>
        <field key="TMR4IE" instance="1" mask="0x0008" desc=""></field>
        <field key="T4IE" instance="1" mask="0x0008" desc=""></field>
        <field key="CCP5IE" instance="1" mask="0x0004" desc=""></field>
        <field key="CCP4IE" instance="1" mask="0x0002" desc=""></field>
        <field key="CCP3IE" instance="1" mask="0x0001" desc=""></field>
      </sfr>
      <sfr key="IPR2" addr="0xFA2" por="1111111111111111" mclr="0000000000000000">
        <field key="OSCFIP" instance="1" mask="0x0080" desc=""/>
        <field key="CMIP" instance="1" mask="0x0040" desc=""/>
        <field key="reserved" instance="1" mask="0x0020" desc=""/>
        <field key="EEIP" instance="1" mask="0x0010" desc=""/>
        <field key="BCLIP" instance="1" mask="0x0008" desc=""/>
        <field key="LVDIP" instance="1" mask="0x0004" desc=""/>
        <field key="TMR3IP" instance="1" mask="0x0002" desc=""/>
        <field key="T3IP" instance="1" mask="0x0002" desc=""/>
        <field key="CCP2IP" instance="1" mask="0x0001" desc=""/>
      </sfr>
      <sfr key="PIR2" addr="0xFA1" por="0000000000000000" mclr="0000000000000000">
        <field key="OSCFIF" instance="1" mask="0x0080" desc=""/>
        <field key="CMIF" instance="1" mask="0x0040" desc=""/>
        <field key="reserved" instance="1" mask="0x0020" desc=""/>
        <field key="EEIF" instance="1" mask="0x0010" desc=""/>
        <field key="BCLIF" instance="1" mask="0x0008" desc=""/>
        <field key="LVDIF" instance="1" mask="0x0004" desc=""/>
        <field key="TMR3IF" instance="1" mask="0x0002" desc=""/>
        <field key="T3IF" instance="1" mask="0x0002" desc=""/>
        <field key="CCP2IF" instance="1" mask="0x0001" desc=""/>
      </sfr>
      <sfr key="PIE2" addr="0xFA0" por="0000000000000000" mclr="0000000000000000">
        <field key="OSCFIE" instance="1" mask="0x0080" desc=""/>
        <field key="CMIE" instance="1" mask="0x0040" desc=""/>
        <field key="reserved" instance="1" mask="0x0020" desc=""/>
        <field key="EEIE" instance="1" mask="0x0010" desc=""/>
        <field key="BCLIE" instance="1" mask="0x0008" desc=""/>
        <field key="LVDIE" instance="1" mask="0x0004" desc=""/>
        <field key="TMR3IE" instance="1" mask="0x0002" desc=""/>
        <field key="T3IE" instance="1" mask="0x0002" desc=""/>
        <field key="CCP2IE" instance="1" mask="0x0001" desc=""/>
      </sfr>
      <sfr key="IPR1" addr="0xF9F" por="1111111111111111" mclr="0000000000000000">
        <field key="PSPIP" instance="1" mask="0x0080" desc=""></field>
        <field key="ADIP" instance="1" mask="0x0040" desc=""></field>
        <field key="RCIP" instance="1" mask="0x0020" desc=""></field>
        <field key="U1RXIP" instance="1" mask="0x0020" desc=""></field>
        <field key="TXIP" instance="1" mask="0x0010" desc=""></field>
        <field key="U1TXIP" instance="1" mask="0x0010" desc=""></field>
        <field key="SSP1IP" instance="1" mask="0x0008" desc=""></field>
        <field key="CCP1IP" instance="1" mask="0x0004" desc=""></field>
        <field key="TMR2IP" instance="1" mask="0x0002" desc=""></field>
        <field key="T2IP" instance="1" mask="0x0002" desc=""></field>
        <field key="TMR1IP" instance="1" mask="0x0001" desc=""></field>
        <field key="T1IP" instance="1" mask="0x0001" desc=""></field>
      </sfr>
      <sfr key="PIR1" addr="0xF9E" por="0000000000000000" mclr="0000000000000000">
        <field key="PSPIF" instance="1" mask="0x0080" desc=""></field>
        <field key="ADIF" instance="1" mask="0x0040" desc=""></field>
        <field key="RCIF" instance="1" mask="0x0020" desc=""></field>
        <field key="TXIF" instance="1" mask="0x0010" desc=""></field>
        <field key="U1TXIF" instance="1" mask="0x0010" desc=""></field>
        <field key="SSP1IF" instance="1" mask="0x0008" desc=""></field>
        <field key="CCP1IF" instance="1" mask="0x0004" desc=""></field>
        <field key="TMR2IF" instance="1" mask="0x0002" desc=""></field>
        <field key="T2IF" instance="1" mask="0x0002" desc=""></field>
        <field key="TMR1IF" instance="1" mask="0x0001" desc=""></field>
        <field key="T1IF" instance="1" mask="0x0001" desc=""></field>
      </sfr>
      <sfr key="PIE1" addr="0xF9D" por="0000000000000000" mclr="0000000000000000">
        <field key="PSPIE" instance="1" mask="0x0080" desc=""></field>
        <field key="ADIE" instance="1" mask="0x0040" desc=""></field>
        <field key="RCIE" instance="1" mask="0x0020" desc=""></field>
        <field key="U1RXIE" instance="1" mask="0x0020" desc=""></field>
        <field key="TXIE" instance="1" mask="0x0010" desc=""></field>
        <field key="U1TXIE" instance="1" mask="0x0010" desc=""></field>
        <field key="SSP1IE" instance="1" mask="0x0008" desc=""></field>
        <field key="CCP1IE" instance="1" mask="0x0004" desc=""></field>
        <field key="TMR2IE" instance="1" mask="0x0002" desc=""></field>
        <field key="T2IE" instance="1" mask="0x0002" desc=""></field>
        <field key="TMR1IE" instance="1" mask="0x0001" desc=""></field>